title,location,city,state,posted_date,job_id,source,first_seen_date,last_seen_date,semantic_similarity,country,url,description_short,description
Encargado de Turno FT - Frutas y Verduras,"Santiago, REGIÓN METROPOLITANA, CL",Santiago,REGIÓN METROPOLITANA,2026-07-08,14455,cencosud,2026-07-12,2026-07-22,0.3174,CL,https://cencosud.csod.com/ux/ats/careersite/5/home/requisition/14455?c=cencosud,,"Encargado/a de Turno Full Time | Jumbo La Reina En Jumbo La Reina estamos en búsqueda de un/a Encargado/a de Turno Full Time para, quien será responsable de liderar la operación durante su turno, asegurando la calidad de los productos, el cumplimiento de los estándares y el correcto funcionamiento del equipo. Misión del cargo Supervisar y coordinar la operación durante el turno, garantizando la calidad de los productos, el cumplimiento de normas de seguridad y una correcta ejecución de los procesos. Principales funciones - Atender dudas y consultas de clientes. - Supervisar el desempeño del personal en la venta y reposición de productos. - Controlar la presentación personal del equipo durante el turno. - Organizar y distribuir tareas al personal de planta y externos. - Supervisar el orden y la presentación de la sección. - Capacitar al personal que se incorpora al equipo. - Mantener coordinación con el Jefe de Sección y Subadministrador de Turno. - Realizar cambios de precios (cartelería y flejes) al cierre del local. - Supervisar el cumplimiento de normas de seguridad y prevención de riesgos. - Controlar temperaturas en naves y cámaras de la sección. - Supervisar, junto a Aseguramiento de Calidad, la recepción de mercadería y su correcta estiba. - Gestionar devoluciones a proveedores cuando corresponda. Perfil del cargo - Persona proactiva, con capacidad de resolución de conflictos. - Buenas relaciones interpersonales y comunicación efectiva. - Capacidad para trabajar en equipo. - Tolerancia al trabajo bajo presión. - Adaptabilidad y flexibilidad frente a los cambios. - Conocimientos en el área de alimentos o producción (deseable). Si te interesa seguir desarrollándote en el área de producción y liderar equipos en una sección clave del negocio, ¡te invitamos a postular a esta oportunidad interna! 🚀"
Jefe de Proyectos SAC y Transformación Digital,"Santiago, REGION METROPOLITANA, CL",Santiago,REGION METROPOLITANA,2026-07-08,14442,cencosud,2026-07-12,2026-07-22,0.2996,CL,https://cencosud.csod.com/ux/ats/careersite/5/home/requisition/14442?c=cencosud,,"En Supermercados Cencosud, buscamos a nuestro/a próximo/a Jefe/a de Proyectos de Servicio al Cliente y Transformación Digital, quien se sumará al equipo de Servicio al Cliente para liderar iniciativas estratégicas de evolución tecnológica, omnicanalidad e inteligencia artificial aplicadas a la atención de clientes. Si tienes experiencia gestionando proyectos digitales, te motiva conectar negocio, tecnología y operación, y te apasiona diseñar experiencias de atención simples, eficientes y humanas, este desafío es para ti 🚀 🎯 ¿Cuál será tu misión? Liderar el diseño, implementación y seguimiento de proyectos de transformación digital en Servicio al Cliente, impulsando soluciones de IA conversacional, CRM, omnicanalidad, automatización e integraciones tecnológicas, en coordinación con equipos de TI, Contact Center y áreas de negocio. Además, tendrás el desafío de liderar al equipo de diseño conversacional, asegurando que nuestras soluciones automatizadas sean resolutivas, empáticas y coherentes con la experiencia que queremos entregar a nuestros clientes. 🔍 Principales responsabilidades Liderar proyectos de transformación digital en Servicio al Cliente, desde el levantamiento de necesidades hasta su implementación y medición de resultados. Coordinar con equipos de TI, Contact Center, Operaciones y áreas de negocio para asegurar una correcta ejecución de las iniciativas. Gestionar el backlog de desarrollos y mejoras, priorizando según impacto en experiencia cliente, eficiencia operacional y factibilidad técnica. Impulsar iniciativas vinculadas a inteligencia artificial conversacional, CRM, omnicanalidad, automatización e integración de canales de atención. Liderar las iniciativas de diseño conversacional, velando por la calidad, claridad, empatía y efectividad de las interacciones automatizadas. Traducir necesidades del negocio y del cliente en requerimientos funcionales claros para los equipos técnicos. Monitorear indicadores clave asociados a los proyectos, tales como satisfacción de clientes, resolución, derivación a ejecutivos, adopción digital, tiempos de atención y eficiencia operacional. Identificar oportunidades de mejora a partir de datos, feedback de clientes, desempeño del Contact Center y comportamiento de los canales digitales. Elaborar reportes de avance, resultados, riesgos y oportunidades para la Gerencia y stakeholders del área. 👀 ¿Qué buscamos? Formación en Ingeniería Comercial, Ingeniería Civil Industrial, Diseño de Servicios, Transformación Digital o carrera afín. Al menos 2 años de experiencia liderando proyectos digitales, tecnológicos, de experiencia cliente, CRM, contact center, automatización o transformación de canales de atención. Experiencia coordinando equipos multidisciplinarios, especialmente con áreas de tecnología, operaciones, negocio y/o proveedores externos. Conocimiento en plataformas CRM, soluciones omnicanal, contact center, y deseable en IA conversacional, automatización o integraciones tecnológicas. Manejo de metodologías de proyectos, mejora continua, agilidad, Scrum, PMO o similares. Capacidad analítica para interpretar datos, monitorear indicadores y convertir hallazgos en acciones concretas. Liderazgo transversal, comunicación efectiva, orientación al cliente y capacidad para movilizar equipos hacia la implementación de soluciones de alto impacto."
Jefe de Procesos Clientes,"Santiago, REGION METROPOLITANA, CL",Santiago,REGION METROPOLITANA,2026-07-08,14443,cencosud,2026-07-12,2026-07-22,0.294,CL,https://cencosud.csod.com/ux/ats/careersite/5/home/requisition/14443?c=cencosud,,"En Supermercados Cencosud, buscamos a nuestro/a próximo/a Jefe/a de Procesos Cliente, quien se sumará al equipo para liderar el diseño, mejora y estandarización de los procesos que impactan directamente en la experiencia del cliente dentro de nuestras tiendas. Si te mueve entender cómo vive el cliente cada visita, tienes ojo para detectar fricciones y la capacidad de traducirlas en mejoras concretas, este desafío es para ti 🚀 🎯 ¿Cuál será tu misión? Liderar la gestión y mejora continua de los procesos orientados al cliente en Supermercados Chile, asegurando una experiencia de compra simple, consistente y de calidad en todos los puntos de contacto, con una mirada end to end y foco en resultados medibles. 🔍 Principales responsabilidades • Mapear, documentar y analizar los procesos actuales que impactan la experiencia del cliente (AS IS). • Identificar brechas, fricciones y oportunidades de mejora, priorizando iniciativas de alto impacto. • Diseñar e implementar procesos mejorados (TO BE) en coordinación con equipos de operaciones, ecommerce, tecnología y comercial • Monitorear KPIs de experiencia cliente: CSAT, Atributos Customer Journey Map, NPS, KPI operacionales, resolución de reclamos y otros indicadores clave. • Liderar iniciativas de estandarización y automatización de procesos con foco en el cliente. • Trabajar de forma transversal con áreas de operaciones, atención al cliente, tecnología y marketing para asegurar una ejecución impecable. • Gestionar proyectos de mejora continua con metodologías ágiles o similares. 👀 ¿Qué buscamos? • Formación en Ingeniería Comercial, Civil Industrial, Administración o carrera afín. • Al menos 4 años de experiencia en gestión de procesos, experiencia cliente o mejora continua, idealmente en retail o consumo masivo. • Conocimiento de metodologías de mejora de procesos: Design Thinking, Lean, Agile o similares. • Manejo de Excel avanzado. Deseable Power BI. Experiencia utilizando IA. • Perfil analítico, con empatía hacia el cliente, liderazgo transversal y orientación a resultados."
Jefe de Centro de Distribución Chillán  – Logística Supermercados Cencosud,"Diguillín, REGIÓN DE ÑUBLE, CL",Diguillín,REGIÓN DE ÑUBLE,2026-07-08,14456,cencosud,2026-07-12,2026-07-22,0.2911,CL,https://cencosud.csod.com/ux/ats/careersite/5/home/requisition/14456?c=cencosud,,"¡Únete al equipo de Cencosud como Jefe de Centro de Distribución en Chillán! En Cencosud, somos uno de los actores más importantes del retail en Latinoamérica. Nuestro equipo de Logística en Supermercados Chile busca un(a) J efe de Centro de Distribución para liderar y optimizar las operaciones de nuestro CD en Chillán. Buscamos un líder estratégico, con visión integral y capacidad para dirigir equipos multidisciplinarios, garantizando la eficiencia operativa y el cumplimiento de los objetivos del negocio. ¿Cuál será tu misión? Velar por el correcto funcionamiento del Centro de Distribución, asegurando el cumplimiento de los procedimientos operacionales y facilitando la relación con todas las áreas de apoyo (Mantenimiento, ACA, Abastecimiento, Comercial y Proveedores). Serás responsable de dirigir mejoras operativas y de sistema, y de garantizar que la operación funcione dentro de los estándares de calidad, seguridad y presupuesto. Desafíos y responsabilidades clave: Liderazgo y Dirección de Equipos: Dirigirás y gestionarás equipos de trabajo compuestos por Jefes de Turno, Supervisores y Analistas, asignando responsabilidades, motivando a colaboradores/as y fomentando un excelente clima laboral. Mejora Continua: Dirigir mejoras operativas y del sistema según las necesidades de la Operación, implementando proyectos que aumenten la eficiencia y reduzcan costos utilizando metodologías Lean. T oma de Decisiones Estratégicas: Apoyar en la toma de decisiones para el correcto funcionamiento de la Operación, analizando resultados y definiendo cambios necesarios. Coordinación Transversal: Relación directa con todas las áreas de apoyo (Mantenimiento, ACA, Comercial, Abastecimiento) y clientes externos (Proveedores), gestionando solicitudes especiales y coordinando pedidos adicionales. Gestión de Capacidades: Programar en conjunto con Abastecimiento las capacidades futuras del Centro de Distribución y planificar los recursos disponibles para cumplir con las exigencias. Control de Gestión: Monitorear KPIs para evaluar eficiencia y calidad del servicio, gestionar y controlar los costos operativos para asegurar que la Operación funcione dentro del presupuesto autorizado. Cumplimiento Normativo: Implementar y controlar estándares operativos, asegurando el cumplimiento de normas de seguridad, BPM y HACCP. Levantamiento y Evaluación: Dirigir levantamientos de las distintas áreas de la Operación para evaluar si la forma de funcionamiento es la correcta y proponer mejoras. ¿Qué buscamos en ti? Formación Académica (Excluyente): Título profesional en Ingeniería Industrial, Ingeniería en Logística, Administración de Empresas o carreras afines. Experiencia: 5 años de experiencia en funciones similares (idealmente en rubro alimentos o retail). Experiencia comprobada liderando equipos de trabajo en centros de distribución, bodegas o entornos operacionales. Conocimientos Técnicos Clave: Mejoramiento Continuo Normativas Herramientas Habilidades y Competencias Liderazgo Proactivo Visión Estratégica Toma de Decisiones Comunicación y Negociación Capacidad Analítica Orientación a Resultados Condiciones del Turno (Rotativo): La operación del Centro de Distribución funciona con tres turnos rotativos, asegurando la continuidad del servicio. Los horarios son: Turno Nocturno Lun a Vie 00: a 08:00 / Sab 00:00 a 07:00 Turno Día Lun a Vie 08:00 a 16:00 / Sab 07:00 a 14:00 Turno Tarde Lun a Vie 16:00 a 00:00 / Sab 14:00 a 21:00 Beneficios que valoramos para ti: En Cencosud, nos preocupamos por tu bienestar y desarrollo. Estos son algunos de los beneficios que tendrás al integrarte a nuestro equipo: 🍽️ Alimentación en Casino: Acceso a casino con servicio de alimentación dentro del Centro de Distribución. 🏥 Seguros complementarios competitivos: Acceso a seguros con coberturas destacadas en el mercado, pensando en tu tranquilidad y la de tu familia. 📈 Desarrollo de carrera profesional: Oportunidades reales de crecimiento dentro de una de las empresas más grandes del retail en Latinoamérica. Valoramos la promoción interna y la capacitación continua. Estabilidad y proyección: Contrato indefinido desde el primer día, con todas las cotizaciones al día. Trabajo en terreno: Posibilidad de desarrollarte en un entorno operativo dinámico y desafiante. ¿Por qué ser parte de Cencosud? Te ofrecemos la oportunidad de desarrollarte profesionalmente en una empresa líder del retail, formando parte de un equipo colaborativo y de alto desempeño. Valoramos el talento, la iniciativa y la capacidad de liderazgo, y te brindamos un espacio para generar un impacto real en la cadena de suministro desde la Región de Ñuble. ¿Te animas al desafío? ¡Postula ahora y construyamos juntos el futuro del retail en Chillán! 🌈 ¡En Cencosud Somos Todos! En Cencosud promovemos un ambiente de trabajo respetuoso, inclusivo y libre de discriminación. Estamos convencidos de que la diversidad en nuestros equipos impulsa la creatividad y la innovación, elementos esenciales para cumplir nuestro propósito: servir de forma extraordinaria en cada momento. Si necesitas algún ajuste razonable o requisito de accesibilidad para participar en la entrevista, por favor indícalo en tu postulación. Queremos que cada persona viva un proceso transparente, cómodo y accesible. Esta oferta laboral se rige por la Ley N.º 21.015, que incentiva la inclusión de personas con discapacidad en el mundo laboral."
Jefe de Prevención de Pérdidas y Seguridad - Easy Viña del Mar,"Viña Del Mar, REGIÓN DE VALPARAÍSO, CL",Viña Del Mar,REGIÓN DE VALPARAÍSO,2026-07-08,14458,cencosud,2026-07-12,2026-07-22,0.2533,CL,https://cencosud.csod.com/ux/ats/careersite/5/home/requisition/14458?c=cencosud,,"🌟 ¡Súmate a nuestro equipo como Jefe/a de Prevención de Pérdidas y Seguridad en Easy Viña del Mar! 🌟 ¿Tienes experiencia sólida en seguridad, control de inventarios y prevención de pérdidas ? Esta es tu oportunidad para liderar un rol clave en los resultados de la tienda, asegurando la disponibilidad de productos y la continuidad operacional con los más altos estándares de seguridad. En Easy buscamos un/a Jefe/a de Prevención de Pérdidas y Seguridad que no solo garantice el stock disponible, sino que además sea capaz de prevenir riesgos y pérdidas, liderando un equipo con foco en la protección de los activos y en la experiencia de compra de nuestros clientes. 🎯 ¿Cuál será tu desafío? ✨ Liderar planes de prevención de pérdidas y seguridad, resguardando los activos de la compañía. ✨ Controlar la ejecución de protocolos de seguridad, velando por el uso adecuado de EPP y coordinación con equipos de vigilancia. ✨ Auditar procesos y asegurar el cumplimiento de procedimientos corporativos y normativas SOX. ✨ Formar y guiar a tu equipo, desarrollando competencias en seguridad operacional."
Líder Marketing Digital & SEM,"Santiago, REGION METROPOLITANA, CL",Santiago,REGION METROPOLITANA,2026-07-07,14441,cencosud,2026-07-12,2026-07-22,0.3458,CL,https://cencosud.csod.com/ux/ats/careersite/5/home/requisition/14441?c=cencosud,,"🌟 ¡Súmate a Easy como Líder de Marketing Digital SEM! 🌟 ¿Te apasiona el marketing digital, el e-commerce y la optimización de campañas de alto impacto? En Easy buscamos un/a Líder de Marketing Digital SEM que quiera potenciar el crecimiento del negocio a través de estrategias de performance, análisis de datos e innovación. Si disfrutas trabajar con tecnología, liderar proyectos transversales y convertir los datos en resultados, este desafío es para ti. 🎯 ¿Cuál será tu desafío? Serás responsable de liderar la estrategia de adquisición digital, optimizando campañas de performance y asegurando el crecimiento del canal digital mediante una gestión basada en datos, innovación y mejora continua. 🚀 Principales responsabilidades ✨ Diseñar, implementar y optimizar la estrategia de Marketing Digital y SEM para impulsar el crecimiento del negocio. ✨ Administrar campañas de Google Ads, Meta Ads y otros canales de adquisición, maximizando el retorno de la inversión. ✨ Analizar indicadores de desempeño, identificar oportunidades y proponer acciones que mejoren los resultados comerciales. ✨ Trabajar de manera colaborativa con equipos de E-commerce, Tecnología, Comercial, SEO, CRM y Growth para potenciar iniciativas digitales. ✨ Liderar proyectos de optimización y automatización, incorporando nuevas herramientas y tendencias del mercado. ✨ Elaborar reportes ejecutivos y presentar resultados, proponiendo mejoras continuas basadas en datos. 🎓 ¿Qué buscamos en ti? 🔹 Título profesional de Ingeniería Comercial, Ingeniería Civil Industrial, Publicidad o carrera afín. 🔹 Al menos 5 años de experiencia laboral, con 3 años o más liderando estrategias de Marketing Digital, Performance o SEM. 🔹 Experiencia idealmente en empresas de retail, e-commerce o industrias de alto tráfico digital. 🔹 Manejo avanzado de plataformas como Google Ads, Meta Ads y Google Analytics 4 (GA4). 🔹 Certificaciones en Google Ads, Meta o Google Analytics (deseables). 🔹 Inglés intermedio. 🔹 Deseable contar con Magíster o especialización en Marketing Digital. 🌟 Buscamos personas que sean ✔️ Proactivas, con autonomía y capacidad para desenvolverse en entornos dinámicos. ✔️ Analíticas y orientadas a resultados. ✔️ Con interés por la tecnología, la innovación y el mundo digital. ✔️ Capaces de movilizar equipos e influir transversalmente, generando alianzas con distintas áreas. ✔️ Con excelentes habilidades comunicacionales, liderazgo e iniciativa para impulsar cambios. ✨ ¿Qué te ofrecemos? 💡 Ser parte de una compañía líder en retail que impulsa constantemente la transformación digital. 📈 Participar en proyectos estratégicos con alto impacto en el crecimiento del negocio. 🤝 Trabajar junto a equipos multidisciplinarios en un ambiente colaborativo, innovador y desafiante. 🚀 Oportunidades de desarrollo profesional, aprendizaje continuo y participación en iniciativas de transformación digital. 👉 Si te apasiona el marketing digital, la tecnología y los desafíos de alto impacto, ¡postula y sé parte de Easy!"
SEO Specialist,"Santiago, REGION METROPOLITANA, CL",Santiago,REGION METROPOLITANA,2026-07-07,14440,cencosud,2026-07-12,2026-07-22,0.3841,CL,https://cencosud.csod.com/ux/ats/careersite/5/home/requisition/14440?c=cencosud,,"En Cencosud buscamos un/a SEO Specialist para integrarse a la Gerencia de Marketing Digital Este rol será responsable de diseñar, ejecutar y optimizar la estrategia SEO de nuestros activos digitales, contribuyendo al crecimiento del tráfico orgánico, la visibilidad de marca y la generación de oportunidades de negocio. Buscamos una persona analítica, ordenada y estratégica, capaz de transformar datos en acciones concretas y generar impacto a través de la optimización continua. 🎯 Misión del Cargo Impulsar el posicionamiento orgánico de las plataformas digitales de la compañía mediante la definición, implementación y seguimiento de estrategias SEO, contribuyendo al cumplimiento de los objetivos comerciales y de crecimiento del negocio a través de la toma de decisiones basadas en datos. 🛠️ Principales Funciones - Diseñar, implementar y ejecutar la estrategia SEO para los distintos sitios y plataformas digitales de la compañía, alineándola con los objetivos comerciales y de crecimiento del negocio. - Analizar palabras clave, tendencias de búsqueda, comportamiento de usuarios y métricas de rendimiento para identificar oportunidades de optimización y apoyar la toma de decisiones. - Monitorear y optimizar el posicionamiento orgánico mediante mejoras en contenido, arquitectura web, aspectos técnicos y experiencia de usuario. - Liderar auditorías SEO técnicas, gestionando iniciativas relacionadas con indexación, rastreo, velocidad de carga y mejores prácticas de posicionamiento. - Coordinar proyectos con equipos de Marketing, E-commerce, Tecnología, UX y Contenidos, impulsando mejoras continuas que fortalezcan la visibilidad y competitividad digital de las marcas. 📊 Formación y Experiencia - Formación profesional en Ingeniería Comercial, Ingeniería Informática, Ingeniería Civil Industrial o carrera afín. - Al menos 1 año de experiencia en posiciones relacionadas con SEO, Marketing Digital o E-commerce. - Conocimiento y manejo de plataformas SEO como Google Search Console, Google Analytics, SEMrush, Ahrefs, Screaming Frog o similares. - Conocimientos de SEO Técnico, SEO On Page, SEO Off Page y estrategias de contenidos. - Manejo de Excel intermedio/avanzado y herramientas de análisis de datos. - Deseable experiencia en Power BI, Looker Studio o herramientas de visualización. 🎓 Competencias y Habilidades - Perfil altamente analítico, ordenado y orientado a resultados. - Capacidad de toma de decisiones, pensamiento estratégico y autonomía para gestionar iniciativas de mejora. - Habilidades de coordinación y trabajo colaborativo con equipos multidisciplinarios. - Proactividad, atención al detalle y orientación a la mejora continua. - Capacidad para transformar datos en insights y oportunidades de negocio. ✨ Buscamos una persona curiosa, proactiva y orientada a la mejora continua, que quiera desafiar el crecimiento digital de nuestras marcas y generar impacto a través de una estrategia SEO basada en datos y visión de negocio."
Diseñador/a SR Vestuario,"Santiago, REGION METROPOLITANA, CL",Santiago,REGION METROPOLITANA,2026-07-06,14422,cencosud,2026-07-12,2026-07-22,0.1803,CL,https://cencosud.csod.com/ux/ats/careersite/5/home/requisition/14422?c=cencosud,,"En Paris, buscamos a nuestro/a próximo/a Diseñadora Sr de Vestuario para las marcas Marittimo y Greenfield, quien se sumará al equipo de Diseño para liderar el desarrollo de colecciones con identidad propia y coherencia estética en dos de las marcas propias más relevantes del portafolio. Si tienes ojo para las tendencias, dominas el proceso de diseño de principio a fin y te mueve construir marcas con carácter real, este desafío es para ti 🚀 🎯 ¿Cuál será tu misión? Liderar el diseño y desarrollo de colecciones de vestuario para Marittimo y Greenfield, asegurando coherencia de marca, relevancia de tendencia y viabilidad comercial en cada colección, desde el concepto hasta el lanzamiento. 🔍 Principales responsabilidades • Desarrollar el concepto y la propuesta estética de cada colección, alineada al ADN de Marittimo y Greenfield. • Diseñar fichas técnicas, rangos y propuestas de producto considerando silueta, tejido, color y detalle. • Investigar y traducir tendencias internacionales al lenguaje de cada marca. • Coordinar con áreas de producto, comercial y proveedores para asegurar la viabilidad técnica y comercial del diseño. • Participar en el proceso de desarrollo con proveedores y seguimiento de muestras hasta la aprobación final. • Mantener coherencia visual y de identidad de marca en todas las piezas de la colección. 👀 ¿Qué buscamos? • Formación en Diseño de Moda, Diseño Textil o carrera afín. • Al menos 4 años de experiencia en diseño de vestuario, idealmente en retail, marcas propias o industria de la moda. • Dominio de Adobe Illustrator y Photoshop. Deseable experiencia con herramientas de patronaje o PLM. • Conocimiento de tendencias, tejidos, construcción de prendas y procesos de desarrollo de producto. • Inglés intermedio-avanzado. • Perfil creativo, meticuloso, con criterio comercial y capacidad de trabajo transversal."
