title,location,city,state,posted_date,job_id,source,first_seen_date,last_seen_date,semantic_similarity,country,url,description_short,description
Jefe de Ventas - Paris Portal Temuco,"Cautín, REGIÓN DE LA ARAUCANÍA, CL",Cautín,REGIÓN DE LA ARAUCANÍA,2026-06-18,14312,cencosud,2026-07-12,2026-07-22,0.2014,CL,https://cencosud.csod.com/ux/ats/careersite/5/home/requisition/14312?c=cencosud,,"🔥 ¡En Paris Portal Temuco buscamos Jefe de Ventas para liderar con energía y visión comercial! 🔥 ¿Tienes experiencia liderando equipos en Retail y te apasiona la atención al cliente? ¡Esta oportunidad es para ti! Queremos que cada experiencia de compra sea cercana, dinámica e inspiradora. Por eso, buscamos un líder capaz de movilizar equipos, potenciar resultados comerciales y asegurar una experiencia destacada en nuestras áreas. 🎯 Tu misión será: • Liderar y motivar al equipo de ventas, impulsando el cumplimiento de metas comerciales. • Velar por una experiencia de compra atractiva y alineada con los estándares de visual y servicio de Paris. • Gestionar campañas comerciales y eventos de temporada dentro del área. • Supervisar la correcta exhibición, reposición y disponibilidad de productos. • Potenciar la venta de garantías y productos intangibles como la tarjeta de crédito Paris. • Coordinar reuniones de equipo orientadas al seguimiento, motivación y desarrollo de las personas. 🧠 Perfil que buscamos: • Mínimo 2 años liderando equipos de ventas en retail (excluyente), idealmente en categoría blanda/dura. • Experiencia en indicadores comerciales, visual y gestión operacional de sala. • Experiencia en venta de garantías y productos intangibles. • Profesional de Ingeniería Comercial, Administración o carrera afín. • Alta capacidad de liderazgo, comunicación efectiva y orientación al cliente. • Capacidad para trabajar bajo presión, priorizar tareas y resolver contingencias de manera ágil. • Proactividad, compromiso y orientación al logro de resultados colectivos. 💼 Condiciones del cargo: • Modalidad 100% presencial. En Cencosud promovemos un ambiente de trabajo respetuoso, inclusivo y libre de discriminación. Estamos convencidos de que la diversidad en nuestros equipos impulsa la creatividad y la innovación, elementos esenciales para cumplir nuestro propósito: servir de forma extraordinaria en cada momento 🌈✨ Si necesitas algún ajuste razonable o requisito de accesibilidad para participar en la entrevista, por favor indícalo en tu postulación. Queremos que cada persona viva un proceso transparente, cómodo y accesible 🤗 Esta oferta laboral se rige por la Ley N.º 21.015, que incentiva la inclusión de personas con discapacidad en el mundo laboral ⚖️ 💥 ¿Estás listo/a para liderar y potenciar la experiencia de compra en Paris? 📩 ¡Postula ahora y sé parte de nuestro equipo!"
Analista Senior de Desarrollo Inmobiliario,"Santiago, REGION METROPOLITANA, CL",Santiago,REGION METROPOLITANA,2026-06-17,14303,cencosud,2026-07-12,2026-07-22,0.2304,CL,https://cencosud.csod.com/ux/ats/careersite/5/home/requisition/14303?c=cencosud,,"En Cencosud buscamos a nuestro próximo/a Analista Senior de Desarrollo Inmobiliario, quien se integrará a un equipo clave para impulsar el crecimiento y expansión del negocio a través de la identificación y desarrollo de nuevas oportunidades. Buscamos a una persona con visión comercial, capacidad analítica y habilidades de relacionamiento, interesada en participar activamente en proyectos inmobiliarios y con proyección hacia roles de mayor liderazgo. 🎯 ¿Cuál será tu misión? Identificar, evaluar y gestionar oportunidades inmobiliarias que contribuyan al crecimiento del negocio, participando en el análisis de ubicaciones, negociación con actores clave y desarrollo de proyectos. 🔍 Principales responsabilidades Identificar y analizar nuevas ubicaciones con potencial de desarrollo, evaluando variables comerciales, demográficas y estratégicas. Participar en la gestión de proyectos inmobiliarios, desde la prospección hasta su concreción. Relacionarse y negociar con arrendadores, propietarios y distintos stakeholders del negocio. Apoyar en la revisión y estructuración de contratos y acuerdos comerciales. Elaborar análisis, reportes y presentaciones para la toma de decisiones. Coordinar con áreas internas como comercial, legal, arquitectura y operaciones para asegurar el avance de los proyectos. 👀 ¿Qué buscamos? Formación en Ingeniería Comercial, Ingeniería Civil, Arquitectura o carrera afín. Experiencia 2 a 3 años en desarrollo inmobiliario, expansión o roles similares. Manejo de Excel y herramientas de Office. Perfil analítico, con orientación comercial y habilidades de negociación. Proactividad, autonomía y capacidad de gestión con múltiples actores. Interés en desarrollarse hacia posiciones de mayor responsabilidad dentro del área."
Subgerente Comercial Easy Puerto Montt,"Puerto Montt, REGIÓN DE LOS LAGOS, CL",Puerto Montt,REGIÓN DE LOS LAGOS,2026-06-17,14299,cencosud,2026-07-12,2026-07-16,0.2577,CL,https://cencosud.csod.com/ux/ats/careersite/5/home/requisition/14299?c=cencosud,,"🌟 ¡Súmate a nuestro equipo como Subgerente/a de Ventas! 🌟 ¿Tienes experiencia en retail, liderando equipos de venta y garantizando experiencias memorables para los clientes? 💪 En compañia líder de mejoramiento del hogar, buscamos a un/a Subgerente/a de Ventas para una de nuestras tiendas más emblemáticas, donde cada día es una oportunidad para inspirar, liderar y dejar huella. 🎯 Tu desafío será: Liderar y desarrollar a tu equipo, fomentando una cultura de servicio, motivación y excelencia operacional. Supervisar el cumplimiento de los procedimientos de venta y estándares de atención, garantizando una experiencia de compra superior. Controlar y optimizar los inventarios, asegurando la disponibilidad de productos, el orden en sala y la reducción de mermas. Implementar campañas comerciales y planes de venta, potenciando las oportunidades de negocio y contribuyendo al cumplimiento de metas. Promover un clima laboral colaborativo y de aprendizaje constante, acompañando a tu equipo en su desarrollo. Monitorear indicadores clave de gestión (ventas, NPS, ticket promedio), impulsando mejoras continuas que reflejen la excelencia de la marca. Participar activamente en la toma de decisiones estratégicas junto al equipo de gerencia, manteniendo la operación de tienda eficiente y alineada a los valores de la empresa. Perfil deseado 🎓 Requisitos: 🔹 Formación técnica o universitaria afín. 🔹 Mínimo 3 años de experiencia en retail. 🔹 Conocimientos sólidos en inventario y gestión comercial. 🔹 Alta capacidad de liderazgo, orientación a resultados y comunicación efectiva. 🔹 Experiencia en Construcción o rubro ferretero (excluyente) 🚀 Te ofrecemos: 💡 Un entorno dinámico donde cada día trae un nuevo desafío. 📈 Oportunidades reales de crecimiento profesional en una compañía líder del retail. Un equipo apasionado por entregar lo mejor, con un propósito claro: 👉 ¡Postula hoy y lidera el cambio en la industria retail!"
Jefe de Ventas - Easy Los Andes,"Valparaiso, REGIÓN DE VALPARAÍSO, CL",Valparaiso,REGIÓN DE VALPARAÍSO,2026-06-17,14300,cencosud,2026-07-12,2026-07-16,0.1743,CL,https://cencosud.csod.com/ux/ats/careersite/5/home/requisition/14300?c=cencosud,,"🌟 ¡Súmate a nuestro equipo como Jefe/a de Ventas en Easy Los Andes! 🌟 ¿Tienes experiencia liderando equipos, conocimientos técnicos en ferretería, jardín o terminaciones, y te apasiona brindar una experiencia de compra excepcional? ¡Esta es tu oportunidad para marcar la diferencia en Easy! En Easy, buscamos un/a Jefe/a de Ventas que sea capaz de impulsar los resultados comerciales, asegurar una experiencia de compra memorable y liderar a su equipo con compromiso y excelencia operativa. 🎯 ¿Cuál será tu desafío? ✨ Controlar la ejecución de los procedimientos definidos por la compañía, asegurando una operación eficiente y enfocada en el cliente. ✨ Promover altos estándares de servicio y satisfacción del cliente, gestionando requerimientos, reclamos y evaluaciones de calidad (IPSOS, NPS). ✨ Liderar a tu equipo, formando y evaluando de manera oportuna, gestionando turnos, capacitaciones y cumplimiento de normas. ✨ Controlar y mejorar los inventarios, asegurando disponibilidad de productos y disminución de mermas. ✨ Implementar y controlar el plan comercial de tienda, campañas y promociones. ✨ Asegurar el cumplimiento de contratos de empresas de servicios externos presentes en la tienda."
Encargado de Turno Textil/Hogar - Jumbo Osorno,"Osorno, REGIÓN DE LOS LAGOS, CL",Osorno,REGIÓN DE LOS LAGOS,2026-06-16,14291,cencosud,2026-07-12,2026-07-22,0.2509,CL,https://cencosud.csod.com/ux/ats/careersite/5/home/requisition/14291?c=cencosud,,"📢 ¡Oportunidad laboral en Jumbo Osorno! Buscamos Encargado/a para la sección de Textil/Hogar 🛍️ En Jumbo Osorno estamos en búsqueda de un/a Encargado/a para la sección de Textil/Hogar, quien será responsable de apoyar la operación de estas áreas, asegurando la correcta reposición, presentación de productos y una excelente experiencia de compra para nuestros clientes. 🔹 Misión del cargo Apoyar la operación de las secciones asignadas, supervisando la correcta reposición, disponibilidad y presentación de los productos, contribuyendo al cumplimiento de los estándares de la compañía y a la satisfacción de los clientes. 🔹 ¿Cuáles serán tus principales funciones? ✅ Supervisar y apoyar la reposición de productos en góndolas y exhibiciones. ✅ Asegurar el orden, limpieza y correcta presentación de los productos en sala. ✅ Verificar etiquetado, precios y correcta implementación de promociones y campañas. ✅ Controlar la disponibilidad de productos y reportar quiebres de stock. ✅ Apoyar en la realización de inventarios y control de existencias. ✅ Coordinar con el equipo de reposición para mantener las secciones abastecidas. ✅ Brindar apoyo y orientación a clientes en sus consultas sobre productos."
Diseñador/a Gráfico/a | Marketing Paris,"Santiago, REGION METROPOLITANA, CL",Santiago,REGION METROPOLITANA,2026-06-16,14288,cencosud,2026-07-12,2026-07-22,0.2549,CL,https://cencosud.csod.com/ux/ats/careersite/5/home/requisition/14288?c=cencosud,,"¿Te apasiona crear campañas que conectan con millones de personas? ¿Te motiva transformar ideas en experiencias visuales memorables? 🚀 En Paris estamos buscando un/a Diseñador/a Gráfico/a para sumarse al equipo de Marketing, participando en el desarrollo creativo de algunas de las campañas más relevantes del retail. 💡 ¿Qué desafíos tendrás? • Diseñar piezas gráficas para campañas institucionales y comerciales como Día de la Madre, Día del Niño, Navidad, Cyber, Días Paris y mucho más. • Desarrollar propuestas visuales atractivas y alineadas a la identidad de marca. • Adaptar contenidos para medios digitales, redes sociales, e-commerce y tiendas. • Participar activamente en procesos creativos, aportando ideas innovadoras y soluciones visuales de alto impacto. • Trabajar de manera colaborativa con equipos de Marketing, Contenidos y Comercial. • Velar por la consistencia visual y calidad de cada campaña. 🎯 Buscamos a alguien que destaque por: • Creatividad y sensibilidad visual. • Capacidad para trabajar en múltiples proyectos simultáneamente. • Atención al detalle y orientación a la excelencia. • Proactividad y trabajo colaborativo. • Interés por las tendencias de diseño, comunicación y retail. 🎓 Requisitos • Título de Diseño Gráfico o carrera afín. • Más de 3 años de experiencia en roles similares. • Manejo avanzado de Adobe Photoshop, Illustrator e InDesign. • Experiencia desarrollando piezas para canales digitales, RRSS, e-commerce y material impreso. • Deseable experiencia en retail, agencias o áreas de marketing. En Cencosud promovemos un ambiente de trabajo respetuoso, inclusivo y libre de discriminación. Estamos convencidos de que la diversidad en nuestros equipos impulsa la creatividad y la innovación, elementos esenciales para cumplir nuestro propósito: servir de forma extraordinaria en cada momento 🌈✨ Si necesitas algún ajuste razonable o requisito de accesibilidad para participar en la entrevista, por favor indícalo en tu postulación. Queremos que cada persona viva un proceso transparente, cómodo y accesible. 🤗 Esta oferta laboral se rige por la Ley N.º 21.015, que incentiva la inclusión de personas con discapacidad en el mundo laboral. ⚖️"
PM Loyalty Partnerships,"Santiago, REGION METROPOLITANA, CL",Santiago,REGION METROPOLITANA,2026-06-15,14287,cencosud,2026-07-12,2026-07-22,0.297,CL,https://cencosud.csod.com/ux/ats/careersite/5/home/requisition/14287?c=cencosud,,"Si te motiva crear, desarrollar e innovar, y quieres ser protagonista de tu crecimiento profesional, este desafío es para ti. En Cencosud buscamos nuestro próximo/a PM Loyalty Partnerships, quien será responsable de liderar la relación estratégica con los partners de los programas de fidelidad, diseñando e implementando planes comerciales y de marketing orientados a la fidelización de clientes y a la generación de nuevos ingresos. Este rol es clave en la evolución de nuestros programas de lealtad, la mejora de la experiencia de canje y el desarrollo de nuevas oportunidades estratégicas con partners externos. Principales funciones: · Liderar la relación comercial con los partners del programa Puntos Cencosud, diseñando e implementando planes de · fidelización que impulsen el uso y el canje de puntos. · Gestionar la relación con los partners del programa Jumbo Prime, con foco en mejorar la propuesta de valor de la membresía, aumentar la satisfacción de los clientes y crecer la base de suscriptores. · Supervisar y optimizar el proceso de canje en los distintos canales digitales, velando por una experiencia simple y consistente para el cliente. · Identificar oportunidades de mejora continua en la relación con los partners y en los modelos de colaboración. · Analizar resultados, hacer seguimiento de KPIs y elaborar reportes estratégicos asociados a fidelización, canje y desempeño de partners. · Diseñar y liderar campañas comerciales y activaciones de alto impacto junto a partners estratégicos, alineadas al calendario comercial y a los objetivos del programa. · Gestionar el ciclo completo de los productos del catálogo de canje, incluyendo definición de mecánicas, carga, stock, vigencias y coordinación con partners para asegurar disponibilidad y performance. · Coordinar con equipos internos (marketing, tecnología, operaciones y finanzas) para asegurar una correcta implementación de iniciativas. ¡En Cencosud Somos Todos! En Cencosud promovemos un ambiente de trabajo respetuoso, inclusivo y libre de discriminación. Estamos convencidos de que la diversidad en nuestros equipos impulsa la creatividad y la innovación, elementos esenciales para cumplir nuestro propósito: servir de forma extraordinaria en cada momento 🌈 Si necesitas algún ajuste razonable o requisito de accesibilidad para participar en la entrevista, por favor indícalo en tu postulación. Queremos que cada persona viva un proceso transparente, cómodo y accesible. Esta oferta laboral se rige por la Ley N.º 21.015, que incentiva la inclusión de personas con discapacidad en el mundo laboral."
Jefe Omnicanal - Paris Marina Arauco,"Valparaiso, VALPARAISO, CL",Valparaiso,VALPARAISO,2026-06-15,14283,cencosud,2026-07-12,2026-07-22,0.2246,CL,https://cencosud.csod.com/ux/ats/careersite/5/home/requisition/14283?c=cencosud,,"🌟 ¡Únete a nuestro equipo como Jefe/a Omnicanal en Paris! 🌟 #ParisPorUnMundoMejor ¿Te apasiona el retail, la logística y la experiencia del cliente? ¿Eres un líder comprometido con la mejora continua? Entonces esta oportunidad es para ti. En Paris Plaza Vespucio parte del grupo Cencosud, buscamos a nuestro próximo/a Jefe/a Omnicanal, quien será responsable de coordinar y asegurar una experiencia de compra fluida y satisfactoria para nuestros clientes, integrando los canales físicos y digitales de forma eficiente. 🎯 ¿Cuál será tu desafío? Coordinar y gestionar la entrega de mercadería al cliente desde el canal digital. Controlar el stock diario de mercadería por compras vía web. Hacer seguimiento a los productos para despacho que ingresan diariamente a la tienda. Resolver de manera oportuna cualquier problema de stock, manteniendo relación directa con CD, Call Center, área Comercial y Tienda. Asegurar el cumplimiento de los plazos de entrega y despacho comprometidos. Brindar soluciones eficientes ante cualquier requerimiento del cliente. Atender clientes que compran por internet, tanto en modalidad retiro en tienda como despacho a domicilio. 🎓 ¿Qué necesitas para postular? Experiencia en roles similares, idealmente en retail o logística. Conocimiento en procesos de omnicanalidad y atención al cliente. Capacidad de liderazgo, resolución de problemas y orientación al servicio. Habilidades comunicacionales y manejo de equipos multidisciplinarios. Alta capacidad organizativa y de planificación. ¿Qué te ofrecemos? 💡 Un entorno dinámico, en constante transformación. 🤝 La posibilidad de impactar directamente en la experiencia de nuestros clientes. 🌱 Ser parte de una marca comprometida con el desarrollo sostenible y la diversidad. 👉 ¡Postula ahora y sé parte de la evolución del retail junto a Paris! 🚀"
Asistente de Ventas PT 30 HRS | JJO | Plaza Norte,"Santiago, REGION METROPOLITANA, CL",Santiago,REGION METROPOLITANA,2026-06-11,14044,cencosud,2026-07-12,2026-07-22,0.2937,CL,https://cencosud.csod.com/ux/ats/careersite/5/home/requisition/14044?c=cencosud,,"✨ Asistente de Ventas PT 30 HORAS - JJO | Plaza Norte ¿Te apasiona el retail y la moda? ¿Buscas un lugar donde tu energía y ganas de ayudar marquen la diferencia? Estamos buscando a nuestro/a próximo/a Asistente de Ventas para potenciar la experiencia en sala y destacar nuestras marcas exclusivas. 🎯 Objetivo del cargo Asegurar una experiencia de compra memorable a través de una atención proactiva, manteniendo siempre la excelencia en la exhibición y orden de los productos en sala. 🧩 Principales funciones - Abordar a los clientes de forma proactiva para brindar asesoría. - Garantizar una atención de calidad que potencie la venta. - Gestionar la reposición constante de productos. - Mantener el orden y la limpieza del punto de venta. - Cuidar la presentación visual de marcas propias y exclusivas. - Colaborar con el equipo de Visual Merchandising y Jefaturas. 📌 Requisitos del cargo - Educación: Enseñanza Media Completa. - Experiencia: No es necesaria (buscamos actitud y ganas). 🧠 Aptitudes clave - Orientación al servicio. - Proactividad e iniciativa. - Comunicación efectiva. - Empatía con el cliente. - Foco en el orden y detalle. 🌟 ¿Qué ofrecemos? - Pertenecer a una empresa líder en el retail. - Ambiente dinámico y colaborativo. - Oportunidades de crecimiento interno. - Beneficios corporativos de Cencosud. ¿Te interesa sumarte? ¡Postula y ayúdanos a transformar la experiencia de compra!"
Técnico en Mantenimiento - Jumbo Los Trapenses,"Santiago, REGIÓN METROPOLITANA, CL",Santiago,REGIÓN METROPOLITANA,2026-06-11,14280,cencosud,2026-07-12,2026-07-22,0.3243,CL,https://cencosud.csod.com/ux/ats/careersite/5/home/requisition/14280?c=cencosud,,"📢 Oferta Laboral | Técnico/a de Mantenimiento En Cencosud, nos encontramos en búsqueda de un/a Técnico/a de Mantenimiento, cuyo principal objetivo será asegurar la continuidad operativa y el correcto funcionamiento de equipos, instalaciones e infraestructura en nuestros locales, cumpliendo con los estándares técnicos, normativos y de seguridad establecidos por la compañía. 🎯 Misión del cargo Mantener y garantizar de manera eficiente la disponibilidad y funcionalidad de los equipos, instalaciones e infraestructura, ejecutando mantenciones preventivas y correctivas, contribuyendo a la operación segura y continua de los locales. 🧩 Principales responsabilidades - Ejecutar mantenciones preventivas y correctivas en especialidades como electricidad, servicios sanitarios, mecánica, refrigeración, climatización, soldadura y obras civiles. - Asegurar el cumplimiento de los estándares de mantenimiento, orden y uso de elementos de protección personal, conforme a la normativa vigente. - Supervisar y recepcionar trabajos realizados por proveedores externos de mantenimiento. - Realizar chequeos semanales de operatividad en salas técnicas y pruebas de grupos electrógenos. - Diagnosticar fallas técnicas y proponer mejoras continuas. - Cerrar órdenes de trabajo (OT) en la aplicación Infor, conforme a los requerimientos operativos. - Ejecutar cursos obligatorios en el Campus Cencosud. - Realizar charlas, inducciones y registros asociados a prevención de riesgos. 🎓 Requisitos - Técnico de nivel medio o superior en el área de Mantenimiento o afín. - Experiencia mínima de 1 año en cargos similares. - Conocimientos en mantenimiento preventivo y correctivo de instalaciones. - Deseable experiencia trabajando con proveedores externos. 💼 Perfil buscado - Persona proactiva, analítica y detallista. - Capacidad de planificación, coordinación y trabajo autónomo. - Orientación a resultados y cumplimiento de estándares. - Capacidad para trabajar bajo presión y adaptarse a entornos dinámicos. - Compromiso con la seguridad, el orden y la mejora continua. 🌈 Promovemos un ambiente de trabajo respetuoso, inclusivo y libre de discriminación. Estamos convencidos de que la diversidad en nuestros equipos impulsa la creatividad y la innovación, elementos esenciales para cumplir nuestro propósito: servir de forma extraordinaria en cada momento. 🌈 Si necesitas algún ajuste razonable o requisito de accesibilidad para participar en el proceso, por favor indícalo en tu postulación. Queremos que cada persona viva una experiencia transparente, cómoda y accesible. Esta oferta laboral se rige por la Ley N.º 21.015, que incentiva la inclusión de personas con discapacidad en el mundo laboral. 📩 Si buscas desarrollarte en una empresa sólida y con foco en la excelencia operativa, te invitamos a postular y ser parte de Cencosud."
Jefe de Ventas - Paris Viña del Mar,"Viña Del Mar, REGIÓN DE VALPARAÍSO, CL",Viña Del Mar,REGIÓN DE VALPARAÍSO,2026-06-09,14270,cencosud,2026-07-12,2026-07-22,0.169,CL,https://cencosud.csod.com/ux/ats/careersite/5/home/requisition/14270?c=cencosud,,"🔥 ¡En Paris Viña del Mar buscamos Jefe de Ventas para liderar nuestra categoría blanda con energía y visión comercial! 🔥 ¿Tienes experiencia liderando equipos en Retail y te apasiona el mundo de la moda, vestuario y atención al cliente? ¡Esta oportunidad es para ti! Queremos que cada experiencia de compra sea cercana, dinámica e inspiradora. Por eso, buscamos un líder capaz de movilizar equipos, potenciar resultados comerciales y asegurar una experiencia destacada en nuestras áreas de vestuario, calzado y accesorios. 🎯 Tu misión será: • Liderar y motivar al equipo de ventas de categoría blanda, impulsando el cumplimiento de metas comerciales. • Velar por una experiencia de compra atractiva y alineada con los estándares de visual y servicio de Paris. • Gestionar campañas comerciales y eventos de temporada dentro del área. • Supervisar la correcta exhibición, reposición y disponibilidad de productos. • Potenciar la venta de garantías y productos intangibles como la tarjeta de crédito Paris. • Coordinar reuniones de equipo orientadas al seguimiento, motivación y desarrollo de las personas."
