title,team,location,city,state,posted_date,job_id,source,first_seen_date,last_seen_date,semantic_similarity,worker_type,schedule_type,company_name,education,country,experience_level,application_deadline,url,description_short,description,vacancies,requirements
"Mecánico, San Bernardo",Otra Área,"San Bernardo, Metropolitana de Santiago",San Bernardo,Metropolitana de Santiago,2026-07-21,6103824,watts,2026-07-21,2026-07-24,0.3364,Técnico,Jornada Completa,Watts S.A.,Técnico profesional superior,Chile,2 años,2026-07-28,https://watts.trabajando.cl/trabajo-empleo/mecanico-san-bernardo/trabajo/6103824,¡En Watt s buscamos nuevos talentos!...,"¡En Watt s buscamos nuevos talentos!
En tu despensa, refrigerador o congelador hay, al menos, un producto elaborado por Watt's. Es por esto que queremos invitarte a ser parte de una de las principales empresas de alimentos del país y ayudarnos a seguir creciendo, diversificándonos e innovando.
Estamos en búsqueda de nuestro próximo Mecánico, para nuestra gerencia de Producción, planta San Bernardo.
Objetivo del Cargo:
Asegurar el correcto funcionamiento de máquinas/equipos productivos para el área de refinería, aplicable dentro de la ejecución de planes de mantenimiento preventivo y actividades de mantenimiento correctivo. Con el propósito de brindar una atención eficiente y eficaz para dar solución y/o mejorar las actividades productivas de la planta.
Tus desafíos serían:
MAQUINARIA:
Ejecutar actividades de mantención mecánica planeada o correctiva, recuperando repuestos, instalándolos, desarmando y montando según los requerimientos, para asegurar un correcto funcionamiento de la planta, cumpliendo con la planificación establecida.
Responsable de equipos propios de la planta, tales como: motores, bombas, piping, empaquetadura e infraestructura general.
REPORTES:
Documentar en SAP las órdenes de trabajo.
Generación de permisos de trabajo en el área de prevención.
Identificar la causa raíz de fallas.
Ofrecemos:
Casino en las plantas de acuerdo a tu jornada de trabajo.
Buses de acercamiento a distintas comunas.
Aguinaldo de fiestas patrias y navidad.
Días administrativos.
Seguro complementario de Salud y Dental.
Ropa de trabajo para los cargos que así lo requieran.
Sala cuna o bono para trabajadoras con hijos menores de hasta 2 años.
Venta de productos con descuentos exclusivos Watt s.
Y más...",1,"¿Qué esperamos de ti?
2-3 años de experiencia en cargos similares.
Técnico en mantenimiento industrial, automatización, eléctrico o afín.
Manejo de SAP.
Manejo de Excel básico.
Conocimiento en: maquinarias de producción, montaje, análisis de fallas (deseable).
Capacidad para gestionar repuestos según inspección técnica de equipos."
Analista Logístico,Otra Área,"San Bernardo, Metropolitana de Santiago",San Bernardo,Metropolitana de Santiago,2026-07-15,6102464,watts,2026-07-17,2026-07-23,0.4004,Analista,Jornada Completa,Watts S.A.,Técnico profesional superior,Chile,1 años,2026-07-22,https://watts.trabajando.cl/trabajo-empleo/analista-logistico/trabajo/6102464,En Watt s buscamos nuevos talentos!...,"En Watt s buscamos nuevos talentos!
En tu despensa, refrigerador o congelador hay, al menos, un producto elaborado por Watt's. Es por esto que queremos invitarte a ser parte de una de las principales empresas de alimentos del país y ayudarnos a seguir creciendo, diversificándonos e innovando.
Estamos en búsqueda de nuestro próximo Analista logístico, para nuestra gerencia de Planificación y Cadena de Suministro, planta San Bernardo.
Objetivo del cargo
Brindar apoyo administrativo y operativo al Centro de Distribución en materias relacionadas con la gestión de personas, contribuyendo al correcto funcionamiento de los procesos internos, el cumplimiento documental y el seguimiento de indicadores asociados a asistencia, productividad y clima laboral.
Principales funciones:
Apoyar la gestión administrativa de personas del Centro de Distribución.
Realizar seguimiento y control de asistencia del personal.
Apoyar en el control y monitoreo de indicadores de productividad.
Colaborar en la ejecución de iniciativas de clima laboral y bienestar.
Mantener actualizada la documentación del personal, verificando la vigencia de documentos requeridos (por ejemplo, licencias de conducir de operadores de maquinaria, certificaciones u otros).
Gestionar y mantener registros administrativos del área.
Coordinar y dar seguimiento a solicitudes administrativas relacionadas con el personal.
Apoyar en la elaboración de reportes e indicadores del área.
Colaborar con otras áreas para asegurar el cumplimiento de los procesos internos y normativas vigentes.
Ofrecemos:
Casino en las plantas de acuerdo a tu jornada de trabajo.
Aguinaldo de fiestas patrias y navidad.
Días administrativos.
Seguro complementario de Salud y Dental.
Ropa de trabajo para los cargos que así lo requieran.
Sala cuna o bono para trabajadoras con hijos menores de hasta 2 años.
Venta de productos con descuentos exclusivos Watt s.
Requisitos del cargo
Título de nivel técnico en Administración de Empresas, Recursos Humanos o carrera afín.
Deseable experiencia de al menos 1 año en funciones administrativas, logística o apoyo a gestión de personas.
Manejo de Microsoft Excel nivel intermedio.
Deseable conocimiento en control de asistencia y documentación laboral.",1,"Requisitos del cargo
Título de nivel técnico en Administración de Empresas, Recursos Humanos o carrera afín.
Deseable experiencia de al menos 1 año en funciones administrativas, logística o apoyo a gestión de personas.
Manejo de Microsoft Excel nivel intermedio.
Deseable conocimiento en control de asistencia y documentación laboral."
Analista de Inventarios Bodega,Otra Área,"San Bernardo, Metropolitana de Santiago",San Bernardo,Metropolitana de Santiago,2026-07-10,6100624,watts,2026-07-17,2026-07-17,0.3501,Operario,En terreno,Watts S.A.,Técnico medio/ colegio técnico,Chile,1 años,2026-07-17,https://watts.trabajando.cl/trabajo-empleo/analista-de-inventarios-bodega/trabajo/6100624,¡En Watt s buscamos nuevos talentos!...,"¡En Watt s buscamos nuevos talentos!
En tu despensa, refrigerador o congelador hay, al menos, un producto elaborado por Watt's. Es por esto que queremos invitarte a ser parte de una de las principales empresas de alimentos del país y ayudarnos a seguir creciendo, diversificándonos e innovando.
Estamos en búsqueda de nuestro próximo Analista de Inventarios Bodega, para nuestra gerencia de Planificación y Cadena de Suministro, planta San Bernardo
Tus desafíos serían:
Controlar la exactitud y consistencia entre el inventario físico y el sistema SAP.
Ejecutar y supervisar conteos cíclicos, investigando y corrigiendo diferencias detectadas.
Revisar y validar diariamente movimientos de inventario, asegurando su correcta imputación y respaldo documental.
Verificar ingresos, recepciones, traslados y regularizaciones, garantizando la concordancia entre documentación física y sistema.
Monitorear stocks críticos, materiales bloqueados, vencidos o con riesgo de quiebre y sobrestock.
Investigar desviaciones operativas relacionadas con consumos, picking, ajustes y movimientos de inventario.
Controlar y analizar mermas, asegurando su correcta autorización y trazabilidad.
Revisar materiales sin movimiento y proponer acciones para optimizar el inventario y evitar obsolescencia.
Participar activamente en la preparación y ejecución de cierres mensuales de inventario.
Generar reportes e indicadores de gestión, elaborando informes ejecutivos sobre resultados y desviaciones.
Asegurar la trazabilidad, documentación y cumplimiento de los procedimientos internos de inventario.
Proponer mejoras continuas en los procesos de control y gestión de inventarios.
Ofrecemos:
Casino en las plantas de acuerdo a tu jornada de trabajo.
Aguinaldo de fiestas patrias y navidad.
Días administrativos.
Seguro complementario de Salud y Dental.
Ropa de trabajo para los cargos que así lo requieran.
Sala cuna o bono para trabajadoras con hijos menores de hasta 2 años.
Venta de productos con descuentos exclusivos Watt s.
Y más...",1,"¿Qué esperamos de ti?
Formación Técnica en Logística, Administración o carrera afín.
1-2 años de experiencia en control y gestión de inventarios en centros de distribución o entornos productivos.
Experiencia en conteos cíclicos, análisis de diferencias de inventario y participación en cierres mensuales.
Manejo de SAP MM y control de movimientos de inventario.
Conocimientos sólidos en control de inventarios físicos y sistémicos.
Excel nivel intermedio (tablas dinámicas, fórmulas, análisis y reportes).
Deseable conocimiento de WMS, metodologías Lean/Kaizen, FIFO/FEFO y trazabilidad por lotes.
Disponibilidad para participar en cierres mensuales y cumplimiento de normas de seguridad."
Ayudante Operador Recepción de Leche - Lonquén,Otra Área,"San Bernardo, Metropolitana de Santiago",San Bernardo,Metropolitana de Santiago,2026-07-07,6098920,watts,2026-07-17,2026-07-24,0.3506,Operario,Por Turnos,Watts S.A.,Media,Chile,1 años,2026-06-08,https://watts.trabajando.cl/trabajo-empleo/ayudante-operador-recepcion-de-leche-lonquen/trabajo/6098920,¡En Watt's buscamos nuevos talentos!...,"¡En Watt's buscamos nuevos talentos!
En tu despensa, refrigerador o congelador hay, al menos, un producto elaborado por Watt's. Es por esto que queremos invitarte a ser parte de una de las principales empresas de alimentos del país y ayudarnos a seguir creciendo, diversificándonos e innovando.
Estamos en búsqueda de un Ayudante Operador Recepción de Leche para integrarse a nuestro equipo en una de nuestras plantas productivas.
Tu objetivo principal será realizar la descarga de materias primas, asegurando su correcto almacenamiento para ser utilizadas en la elaboración de nuestros productos, cumpliendo con los estándares de calidad, inocuidad, BPM y aseo del área.
Principales funciones y responsabilidades:
Recepcionar y descargar materias primas como leche, suero y crema, asegurando su correcto almacenamiento según las cantidades recibidas y los análisis previamente aprobados.
Controlar las condiciones de temperatura y capacidad de llenado durante el proceso de recepción y almacenamiento de materias primas.
Verificar que las materias primas se encuentren en buen estado para ser utilizadas en los procesos productivos.
Realizar el correcto llenado de registros de trazabilidad, cumpliendo con el manual operativo y los estándares definidos por la compañía.
Asegurar la limpieza del área y de los equipos de trabajo, contribuyendo al cumplimiento de las Buenas Prácticas de Manufactura y a la inocuidad del producto.
¿Qué esperamos de ti?
Enseñanza media completa.
Al menos 1 año de experiencia en plantas de producción o cargos similares.
Idealmente conocimientos en manipulación de alimentos y mecánica básica.
Disponibilidad para trabajar presencialmente en planta.
Disponibilidad para trabajar en turnos rotativos de mañana, tarde y noche.
Ofrecemos:
Buses de acercamiento en diferentes comunas del país.
Casino en las plantas de acuerdo a tu jornada de trabajo.
Aguinaldo de fiestas patrias y navidad.
Días administrativos.
Seguro complementario de Salud y Dental.
Ropa de trabajo para los cargos que así lo requieran.
Sala cuna o bono para trabajadoras con hijos menores de hasta 2 años.
Venta de productos Watt s con descuentos exclusivos.",1,"Enseñanza media completa.
Al menos 1 año de experiencia en plantas de producción o cargos similares.
Idealmente conocimientos en manipulación de alimentos y mecánica básica.
Disponibilidad para trabajar presencialmente en planta.
Disponibilidad para trabajar en turnos rotativos de mañana, tarde y noche."
Ayudante de Formulación - Lonquén,Otra Área,"San Bernardo, Metropolitana de Santiago",San Bernardo,Metropolitana de Santiago,2026-07-07,6098740,watts,2026-07-17,2026-07-24,0.3459,Operario,Jornada Completa,Watts S.A.,Media,Chile,,2026-06-08,https://watts.trabajando.cl/trabajo-empleo/ayudante-de-formulacion-lonquen/trabajo/6098740,¡En Watt's buscamos nuevos talentos!...,"¡En Watt's buscamos nuevos talentos!
En tu despensa, refrigerador o congelador hay, al menos, un producto elaborado por Watt s. Por eso, te invitamos a ser parte de una de las principales empresas de alimentos del país y ayudarnos a seguir creciendo, diversificándonos e innovando.
Estamos en búsqueda de un Ayudante de Formulación para nuestra Planta Lonquén, ubicada en Av. Lonquén 12021, San Bernardo.
Objetivo del cargo
Apoyar el proceso de Formulación, asegurando el correcto traslado, preparación, carga, identificación y distribución de insumos en conos, cumpliendo con los estándares de seguridad, orden, limpieza e inocuidad de la planta..
Principales funciones y responsabilidades
Trasladar tambores a la zona específica indicada en el área de Formulación.
Trasladar conos vacíos y limpios a los sectores requeridos.
Abrir tambores y vaciarlos al cono según instrucciones.
Identificar los conos de acuerdo a la rotulación preestablecida.
Distribuir los conos cargados e identificados a los sectores requeridos.
Retirar tambores vacíos, paletizarlos y enviarlos a la sección de lavado.
Eliminar bolsas y residuos en el contenedor correspondiente.
Ubicar tapas y aros de acuerdo a las instrucciones de operación.
Cumplir con los registros requeridos del proceso.
Reemplazar a otros operarios cuando se requiera (ayudante mezclador y/o ayudante refinador)
Ofrecemos:
Casino en las plantas de acuerdo a tu jornada de trabajo.
Aguinaldo de fiestas patrias y navidad.
Seguro complementario de Salud y Dental.
Ropa de trabajo para los cargos que así lo requieran.
Giftcard mensual para canjear por productos Watt´s.
Entre otros.",1,"Realizar el programa de aseo diario y semanal del área.
Mantener el área de trabajo limpia y ordenada, y apoyar en faenas de aseo de planta cuando se requiera.
Cumplir las exigencias de 5S, BPM y los procedimientos de HACCP.
Prevenir accidentes, identificando riesgos y condiciones inseguras, y actuando con foco en la seguridad."
Operador de bodega - BUIN,Otra Área,"Buin, Metropolitana de Santiago",Buin,Metropolitana de Santiago,2026-07-06,6098621,watts,2026-07-17,2026-07-24,0.3278,Operario,En terreno,Watts S.A.,Media,Chile,1 años,2026-05-08,https://watts.trabajando.cl/trabajo-empleo/operador-de-bodega-buin/trabajo/6098621,¡En Watt s buscamos nuevos talentos!...,"¡En Watt s buscamos nuevos talentos!
En tu despensa, refrigerador o congelador hay, al menos, un producto elaborado por Watt's. Es por esto que queremos invitarte a ser parte de una de las principales empresas de alimentos del país y ayudarnos a seguir creciendo, diversificándonos e innovando.
Estamos en búsqueda de nuestros próximos Operadores de bodega, para nuestra gerencia de Planificación y Cadena de Suministro, Bodega Buin.
Ubicada en: Linderos Hermanos Carrera 0475, Linderos
Tus desafíos serán:
Ejecutar el almacenamiento de mercadería, realizando la movilización y estiba en la bodega y racks correspondientes de todos los productos recepcionados, provenientes tanto de clientes internos como externos al Centro de Distribución (plantas, otros CD y compañías externas), siguiendo las instrucciones definidas por el sistema WMS.
Inspeccionar la mercadería recepcionada, resguardando la integridad de los productos movilizados y del recurso pallet, asegurando que ambos se encuentren en condiciones óptimas para la operación.
Ejecutar labores de despacho de mercadería (carga y descarga), movilizando los productos de manera cuidadosa y eficiente para abastecimientos entre centros de distribución, otras instalaciones de la compañía y rutas de distribución a puntos de venta.
Mantener la bodega en condiciones de orden y limpieza, asegurando la correcta disposición de pallets, retiro de residuos de embalaje (film, mallas u otros materiales de estiba) y facilitando los procesos de control e inventario. Asimismo, realizar repaletizado de productos cuando corresponda.
Participar en los procesos de inventario mensual, ejecutando conteos de posiciones y verificaciones de stock.
Mantener en buenas condiciones de limpieza y funcionamiento los equipos móviles utilizados en la operación, tales como transpaletas manuales y eléctricas, grúas order picker, reach y horquilla.
Velar por el correcto uso y mantenimiento de las baterías de los equipos móviles, realizando carga y reposición de líquido cuando corresponda.
Cuidar y mantener operativos los equipos de radiofrecuencia asignados para la ejecución de las tareas.
Operar los distintos equipos móviles disponibles en el Centro de Distribución para el desarrollo de las funciones operativas, incluyendo transpaletas manuales y eléctricas, grúa order picker, grúa reach y grúa horquilla.
Ofrecemos:
Bono por traslado
Bono por colación
Seguro complementario de Salud y Dental.
Ropa de trabajo.
Sala cuna o bono para trabajadoras con hijos menores de hasta 2 años.
Venta de productos con descuentos exclusivos Watt's
Y más...",3,"¿Qué esperamos de ti?
Vivir en Buin o alrededores.
Contar con licencia de conducir clase D vigente (excluyente).
Experiencia previa en cargos similares en operaciones de bodega o centros de distribución.
Disponibilidad para trabajar en turnos rotativos (Mañana y Tarde).
Enseñanza media completa.
Conocimientos en sistema WMS y manejo de documentos mercantiles (deseable).
Contar con movilización propia."
Asistente de desarrollo,Otra Área,"San Bernardo, Metropolitana de Santiago",San Bernardo,Metropolitana de Santiago,2026-07-06,6098523,watts,2026-07-17,2026-07-24,0.3271,Asistente,Jornada Completa,Watts S.A.,Técnico medio/ colegio técnico,Chile,1 años,2026-05-08,https://watts.trabajando.cl/trabajo-empleo/asistente-de-desarrollo/trabajo/6098523,¡En Watt s buscamos nuevos talentos!...,"¡En Watt s buscamos nuevos talentos!
En tu despensa, refrigerador o congelador hay, al menos, un producto elaborado por Watt's. Es por esto que queremos invitarte a ser parte de una de las principales empresas de alimentos del país y ayudarnos a seguir creciendo, diversificándonos e innovando.
Estamos en búsqueda de nuestro próximo Asistente de Desarrollo, para nuestra gerencia de Desarrollo, Calidad y Medio Ambiente, planta San Bernardo y Lonquén.
Tus desafíos serían:
Soporte al Ingeniero de Desarrollo en la realización de las labores asignadas.
Coordinación de muestras de materiales para ensayos y acompañamiento de los mismos.
Gestionar y coordinar muestras internas y de proveedores.
Generación de formularios y tickets para la creación de códigos SAP de materiales.
Generar solicitudes de análisis y estabilidades.
Apoyo en la generación de documentación técnica y reportes.
Dar soporte en las evaluaciones de productos con las distintas áreas.
Ofrecemos:
Casino en las plantas de acuerdo a tu jornada de trabajo.
Aguinaldo de fiestas patrias y navidad.
Días administrativos.
Seguro complementario de Salud y Dental.
Ropa de trabajo para los cargos que así lo requieran.
Sala cuna o bono para trabajadoras con hijos menores de hasta 2 años.
Venta de productos con descuentos exclusivos Watt s.
Y más...",1,"¿Qué esperamos de ti?
Técnico en alimentos o carrera afín.
Al menos 1 año de experiencia en el área.
Disponibilidad para trabajar de manera presencial en Planta San Bernardo y Lonquén.
Conocimiento en evaluaciones organolépticas (deseable).
Nivel de office usuario o superior.
Conocimiento en SAP (para modificación de listas de materiales) (deseable)."
Operador Formulador - Lonquén,Otra Área,"San Bernardo, Metropolitana de Santiago",San Bernardo,Metropolitana de Santiago,2026-07-06,6098434,watts,2026-07-17,2026-07-24,0.3477,Operario,Por Turnos,Watts S.A.,Técnico medio/ colegio técnico,Chile,1 años,2026-05-08,https://watts.trabajando.cl/trabajo-empleo/operador-formulador-lonquen/trabajo/6098434,¡En Watt's buscamos nuevos talentos!...,"¡En Watt's buscamos nuevos talentos!
En tu despensa, refrigerador o congelador hay, al menos, un producto elaborado por Watt's. Es por esto que queremos invitarte a ser parte de una de las principales empresas de alimentos del país y ayudarnos a seguir creciendo, diversificándonos e innovando.
Estamos en búsqueda de un Operador Formulador para nuestra Planta Lonquén, ubicada en Av Lonquén 12021, San Bernardo, Región Metropolitana.
Tus desafíos serán:
Operar de manera adecuada y eficiente los equipos de carga y mezclado, de acuerdo a los manuales de operación y a los instructivos de trabajo.
Garantizar el cumplimiento del programa de producción bajo los estándares de seguridad, calidad y eficiencia productiva, y de acuerdo a los programas de Mejoramiento Operacional y Aseguramiento de Calidad.
¿Qué esperamos de ti?
Deseable enseñanza media industrial.
Experiencia en procesos productivos.
Manejo de PC nivel usurario.
Conocimientos de programas y normativas de aseguramiento de calidad.
Disponibilidad para trabajar en Turnos Rotativos AM/PM/Noche.
Disponibilidad para trabajar de manera presencial en San Bernardo.
Ofrecemos:
Buses de acercamiento para diferentes comunas del país.
Casino en las plantas de acuerdo a tu jornada de trabajo.
Aguinaldo de fiestas patrias y navidad.
Seguro complementario de Salud y Dental.
Ropa de trabajo para los cargos que así lo requieran.
Sala cuna o bono para trabajadoras con hijos menores de hasta 2 años.
Venta de productos Watt s con descuentos exclusivos.
(Contrato plazo fijo y luego indefinido según desempeño)",1,"Deseable enseñanza media industrial.
Experiencia en procesos productivos.
Manejo de PC nivel usurario.
Conocimientos de programas y normativas de aseguramiento de calidad.
Disponibilidad para trabajar en Turnos Rotativos AM/PM/Noche.
Disponibilidad para trabajar de manera presencial en San Bernardo."
"Electromecánico, Chillán",Otra Área,"Chillán, Ñuble",Chillán,Ñuble,2026-07-03,6097942,watts,2026-07-17,2026-07-24,0.2793,Técnico,Por Turnos,Watts S.A.,Técnico profesional superior,Chile,1 años,2026-02-08,https://watts.trabajando.cl/trabajo-empleo/electromecanico-chillan/trabajo/6097942,¡En Watt s buscamos nuevos talentos!...,"¡En Watt s buscamos nuevos talentos!
En tu despensa, refrigerador o congelador hay, al menos, un producto elaborado por Watt's. Es por esto que queremos invitarte a ser parte de una de las principales empresas de alimentos del país y ayudarnos a seguir creciendo, diversificándonos e innovando.
Estamos en búsqueda de nuestro próximo Electromecánico, para nuestra gerencia de Producción, Planta Chillán.
Tus desafíos serían:
Realizar mantenimiento preventivo y correctivo en líneas de envasado y equipos de automatización.
Ejecutar diagnósticos online en PLCs y realizar ajustes o modificaciones menores a la lógica de control.
Programar, configurar y diagnosticar paneles de operador (HMIs).
Configurar y mantener variadores de frecuencia (VFD) y servomotores.
Calibrar y mantener sensores de temperatura (PT100), transmisores de presión diferencial (filtros HEPA) y sensores de flujo.
Verificar y mantener instrumentación industrial con señales 4-20 mA / 0-10 V.
Monitorear y asegurar el correcto funcionamiento de los sistemas de automatización y control de la planta.
Ofrecemos:
Casino en las plantas de acuerdo a tu jornada de trabajo.
Aguinaldo de fiestas patrias y navidad.
Días administrativos.
Seguro complementario de Salud y Dental.
Ropa de trabajo para los cargos que así lo requieran.
La oportunidad de desarrollarte dentro de una compañía con altos estándares, con foco constante en innovación y excelencia operativa.
Sala cuna o bono para trabajadoras con hijos menores de hasta 2 años.
Venta de productos con descuentos exclusivos Watt s.",1,"¿Qué esperamos de ti?
Título técnico en: Electricidad, Electromecánica o Automatización y control.
Conocimientos deseables en:
Automatización de procesos y programación
Lógica de control.
Programación y diagnóstico de PLCs y HMIs.
Configuración de variadores de frecuencia (VFD) y servomotores.
Robótica y software asociado.
Manejo de instrumentación industrial (señales 4-20 mA y 0-10 V) (deseable).
Experiencia en análisis de fallas, averías y diagnósticos a través de programación (correctivo o predictivo).
Disponibilidad para turnos rotativos (mañana, tarde, noche)."
