title,team,location,city,state,posted_date,job_id,source,first_seen_date,last_seen_date,semantic_similarity,worker_type,schedule_type,company_name,education,country,experience_level,application_deadline,url,description_short,description,vacancies,requirements
Preparador de Pedidos - San Bernardo ,Otra Área,"San Bernardo, Metropolitana de Santiago",San Bernardo,Metropolitana de Santiago,2026-07-02,6097287,watts,2026-07-17,2026-07-24,0.351,Operario,Por Turnos,Watts S.A.,Media,Chile,1 años,2026-01-08,https://watts.trabajando.cl/trabajo-empleo/preparador-de-pedidos-san-bernardo/trabajo/6097287,¡En Watt's buscamos nuevos talentos!...,"¡En Watt's buscamos nuevos talentos!
En tu despensa, refrigerador o congelador hay, al menos, un producto elaborado por Watt s. Por eso, queremos invitarte a ser parte de una de las principales empresas de alimentos del país y ayudarnos a seguir creciendo, diversificándonos e innovando.
Estamos en búsqueda de un Preparador de Pedidos para nuestra Planta San Bernardo, ubicada en Pdte. Jorge Alessandri Rodríguez 10501, San Bernardo, Región Metropolitana.
Objetivo del cargo
Preparar los pedidos solicitados de forma eficiente, cuidando la calidad del producto y velando por el orden del almacén.
Principales funciones
Revisar el pedido solicitado (tipo de producto, cantidad y ubicación) y recolectar los productos según lo indicado en WMS, armando pallets para su posterior revisión.
Dar aviso cuando los productos no cumplan con los estándares de calidad establecidos.
Gestionar el proceso de revisión y validación de productos en estado de merma, informando al gruero para su reubicación/almacenamiento según corresponda.
Trasladar los pallets con transpaleta al sector de despacho para la validación de salida.
Apoyar en la carga de camiones para agilizar la entrega, cuidando la calidad del despacho y evitando devoluciones.
Operar máquinas básicas de transporte para facilitar el traslado de los pedidos.
Apoyar en el orden del CD y en tareas del área cuando se requiera.
Ofrecemos:
Casino en las plantas de acuerdo a tu jornada de trabajo.
Aguinaldo de fiestas patrias y navidad.
Seguro complementario de Salud y Dental.
Ropa de trabajo para los cargos que así lo requieran.
Giftcard mensual para canjear por productos Watt´s.
Entre otros.",1,"Enseñanza media completa.
Experiencia en industria de consumo masivo (deseable).
Manejo de WMS nivel básico (excluyente).
Disponibilidad para trabajar presencialmente en planta.
Disponibilidad para trabajar en turnos rotativos (mañana, tarde y noche)."
Encargado de Aseguramiento de Calidad - Lonquén,Otra Área,"San Bernardo, Metropolitana de Santiago",San Bernardo,Metropolitana de Santiago,2026-06-30,6096145,watts,2026-07-17,2026-07-24,0.3315,Encargado,Jornada Completa,Watts S.A.,Técnico profesional superior,Chile,1 años,2026-07-30,https://watts.trabajando.cl/trabajo-empleo/encargado-de-aseguramiento-de-calidad-lonquen/trabajo/6096145,¡En Watt's buscamos nuevos talentos!...,"¡En Watt's buscamos nuevos talentos!
En tu despensa, refrigerador o congelador hay, al menos, un producto elaborado por Watt's. Es por esto que queremos invitarte a ser parte de una de las principales empresas de alimentos del país y ayudarnos a seguir creciendo, diversificándonos e innovando.
Estamos en búsqueda de un/a Encargado/a de Aseguramiento de Calidad para nuestra Planta Lonquén, ubicada en Av Lonquén 12021, San Bernardo, Región Metropolitana.
Tu objetivo principal será liderar, mantener y mejorar el Sistema de Gestión de Inocuidad Alimentaria, bajo normativas como FSSC 22000, HACCP, Codex, FDA, entre otras, asegurando el cumplimiento de actividades vinculadas a certificaciones GFSI, auditorías de autoridad sanitaria, visitas de clientes y estándares internos de calidad e inocuidad.
Principales funciones y responsabilidades:
Supervisar el diseño, validación y verificación del plan HACCP y Programas de Prerrequisitos.
Gestionar el plan de monitoreo ambiental, control de plagas, defensa alimentaria, Food Defense y Food Fraud.
Coordinar la atención de auditorías externas, auditorías de clientes y requerimientos de entes reguladores.
Crear, controlar y analizar el sistema documental de aseguramiento de calidad, incluyendo manuales, procedimientos, instructivos y registros asociados a procesos productivos y cumplimiento normativo.
Coordinar y ejecutar actividades vinculadas a la implementación, mantención y mejora de sistemas de calidad como FSSC 22000, HACCP u otros estándares aplicables.
Realizar auditorías de calidad en las distintas etapas de producción y control, identificando desviaciones, proponiendo acciones correctivas y realizando seguimiento a su cumplimiento.
Participar en investigaciones de incidentes o desviaciones de calidad ocurridas en planta, apoyando la implementación de acciones preventivas y correctivas.
Capacitar y difundir procedimientos, buenas prácticas de manufactura y lineamientos de calidad e inocuidad al personal de planta.
Participar en análisis de riesgo, determinación de Puntos Críticos de Control, Prerrequisitos Operativos y verificación del cumplimiento de monitoreos definidos.
Controlar y analizar registros de aseguramiento de calidad, verificando el cumplimiento de programas de limpieza, mantención, calibración, higiene del personal y medidas preventivas definidas por la compañía.
¿Qué esperamos de ti?
Título de educación superior relacionado al área de alimentos, tales como Ingeniería en Alimentos, Ingeniería de Ejecución en Alimentos, Bioquímica, Tecnología en Alimentos o carrera afín.
Conocimientos en norma FSSC 22000, HACCP o estándares afines de inocuidad y calidad alimentaria.
Manejo de Office nivel intermedio.
Experiencia previa de al menos 1 año en plantas productivas.
Capacidad de análisis, orden, proactividad, trabajo en equipo y orientación al cumplimiento de estándares de calidad.
Disponibilidad para trabajar presencialmente en Planta Lonquén.
Ofrecemos:
Buses de acercamiento en diferentes comunas del país.
Casino en las plantas de acuerdo a tu jornada de trabajo.
Aguinaldo de fiestas patrias y navidad.
Días administrativos.
Seguro complementario de Salud y Dental.
Ropa de trabajo para los cargos que así lo requieran.
Sala cuna o bono para trabajadoras con hijos menores de hasta 2 años.
Venta de productos Watt s con descuentos exclusivos.",1,"Título de educación superior relacionado al área de alimentos, tales como Ingeniería en Alimentos, Ingeniería de Ejecución en Alimentos, Bioquímica, Tecnología en Alimentos o carrera afín.
Conocimientos en norma FSSC 22000, HACCP o estándares afines de inocuidad y calidad alimentaria.
Manejo de Office nivel intermedio.
Experiencia previa de al menos 1 año en plantas productivas.
Capacidad de análisis, orden, proactividad, trabajo en equipo y orientación al cumplimiento de estándares de calidad.
Disponibilidad para trabajar presencialmente en Planta Lonquén."
Asistente de Insumos - Planta San Bernardo,Otra Área,"San Bernardo, Metropolitana de Santiago",San Bernardo,Metropolitana de Santiago,2026-06-30,6096063,watts,2026-07-17,2026-07-24,0.3205,Operario,Jornada Completa,Watts S.A.,Media,Chile,1 años,2026-07-30,https://watts.trabajando.cl/trabajo-empleo/asistente-de-insumos-planta-san-bernardo/trabajo/6096063,¡En Watt's buscamos nuevos talentos!...,"¡En Watt's buscamos nuevos talentos!
En tu despensa, refrigerador o congelador hay, al menos, un producto elaborado por Watt's. Es por esto que queremos invitarte a ser parte de una de las principales empresas de alimentos del país y ayudarnos a seguir creciendo, diversificándonos e innovando.
Estamos en búsqueda de un/a Asistente de Insumos para nuestra Planta San Bernardo, ubicada en Pdte Jorge Alessandri Rodríguez 10501, San Bernardo, Región Metropolitana.
Tu objetivo principal será apoyar la continuidad de los procesos productivos, gestionando la solicitud, recepción, control y provisión de materiales de envase, embalaje e insumos requeridos por las líneas productivas, de acuerdo con la programación diaria de producción.
Principales funciones y responsabilidades:
Solicitar, recepcionar y proveer materiales de envase y embalaje a las líneas productivas, según la programación diaria de producción.
Realizar toma de inventarios semanales y mensuales, asegurando el correcto control de insumos y materiales disponibles.
Gestionar devoluciones de materiales de envase y materias primas sobrantes o no utilizadas durante el proceso de envasado.
Mantener el orden de la bodega WIP, resguardando un control eficiente de los insumos y materias primas utilizadas en la operación.
Apoyar la continuidad operacional mediante una adecuada coordinación y disponibilidad de materiales para las áreas productivas.
¿Qué esperamos de ti?
Experiencia en gestión de insumos y materiales de envase.
Manejo de Excel nivel intermedio.
Manejo de SAP.
Disponibilidad para trabajar presencialmente en Planta San Bernardo.
Ofrecemos:
Buses de acercamiento en diferentes comunas del país.
Casino en las plantas de acuerdo a tu jornada de trabajo.
Aguinaldo de fiestas patrias y navidad.
Días administrativos.
Seguro complementario de Salud y Dental.
Ropa de trabajo para los cargos que así lo requieran.
Sala cuna o bono para trabajadoras con hijos menores de hasta 2 años.
Venta de productos Watt s con descuentos exclusivos.",1,"Experiencia en gestión de insumos y materiales de envase.
Manejo de Excel nivel intermedio.
Manejo de SAP.
Disponibilidad para trabajar presencialmente en Planta San Bernardo."
Asistente de Bodega - Planta Lonquén,Otra Área,"San Bernardo, Metropolitana de Santiago",San Bernardo,Metropolitana de Santiago,2026-06-25,6095258,watts,2026-07-17,2026-07-24,0.3159,Operario,Jornada Completa,Watts S.A.,Media,Chile,1 años,2026-07-25,https://watts.trabajando.cl/trabajo-empleo/asistente-de-bodega-planta-lonquen/trabajo/6095258,¡En Watt's buscamos nuevos talentos!...,"¡En Watt's buscamos nuevos talentos!
En tu despensa, refrigerador o congelador hay, al menos, un producto elaborado por Watt's. Es por esto que queremos invitarte a ser parte de una de las principales empresas de alimentos del país y ayudarnos a seguir creciendo, diversificándonos e innovando.
Estamos en búsqueda de un/a Asistente de Bodega para nuestra Planta Lonquén, ubicada en Av Lonquén 12021, San Bernardo, Región Metropolitana.
Tu objetivo principal será asistir a proveedores, técnicos y colaboradores internos en la recepción, ordenamiento, almacenamiento y despacho de materiales, asegurando una correcta gestión documental, control de inventario y apoyo al reaprovisionamiento del área.
Principales funciones y responsabilidades:
Controlar el orden y correcta disposición de los materiales almacenados.
Entregar materiales e insumos a colaboradores internos según requerimientos.
Realizar el almacenamiento de productos, materiales e insumos recibidos.
Ejecutar conteos de inventario mensual.
Apoyar la gestión documental asociada a la operación de bodega.
Contribuir al control y reaprovisionamiento de materiales e insumos para asegurar la continuidad operacional.
¿Qué esperamos de ti?
Enseñanza media completa.
1 año de experiencia en cargos similares, idealmente en áreas de bodega, logística, abastecimiento o almacenamiento.
Conocimientos básicos de Office.
Conocimientos básicos de SAP.
Disponibilidad para trabajar presencialmente en Planta Lonquén.
En Watt's te ofrecemos:
Buses de acercamiento en diferentes comunas del país.
Casino en las plantas de acuerdo a tu jornada de trabajo.
Aguinaldo de fiestas patrias y navidad.
Días administrativos.
Seguro complementario de Salud y Dental.
Ropa de trabajo para los cargos que así lo requieran.
Sala cuna o bono para trabajadoras con hijos menores de hasta 2 años.
Venta de productos Watt s con descuentos exclusivos.",1,"Enseñanza media completa.
1 año de experiencia en cargos similares, idealmente en áreas de bodega, logística, abastecimiento o almacenamiento.
Conocimientos básicos de Office.
Conocimientos básicos de SAP.
Disponibilidad para trabajar presencialmente en Planta Lonquén."
